{
  "$schema": "../schemas/pi-i18n.bundle.schema.json",
  "version": 1,
  "namespace": "pi",
  "locale": "pt-BR",
  "messages": {
    "app.name": "pi",

    "language.command.description": "Trocar o idioma da UI (somente LTR)",
    "language.dialog.title": "Idioma",
    "language.dialog.pick": "Escolher um locale",
    "language.dialog.other": "Outro…",
    "language.dialog.other.placeholder": "ex.: fr, ja, zh-TW",
    "language.changed": "Idioma definido para {locale}",
    "language.alreadySet": "O idioma já está em {locale}",
    "language.reloading": "Recarregando a UI para {locale}…",
    "language.usage": "Uso: /lang [doctor|debug|probe [on|off|reset]|setup beginner|hacks|en|en-US|zh-TW|tw|zhtw|toggle|pick]",
    "language.rtlWarning": "RTL ainda não é suportado (selecionado: {locale}).",

    "doctor.command.description": "Verificar bundles i18n: chaves ausentes e placeholders incompatíveis",
    "i18n.command.description": "Controles i18n: doctor, debug, probe, setup, hacks",
    "i18n.command.usage": "Uso: /lang <doctor|debug|probe [on|off|reset]|setup beginner|hacks>",
    "i18n.hacks.option.on": "core hacks: ligado",
    "i18n.hacks.option.off": "core hacks: desligado",
    "i18n.probe.reset": "i18n probe redefinido",
    "i18n.probe.enabled": "i18n probe ativado",
    "i18n.probe.disabled": "i18n probe desativado",
    "i18n.setup.usage": "Uso: /lang setup beginner",
    "i18n.setup.applied": "i18n setup aplicado (preset=beginner, locale={locale})",
    "doctor.ok": "i18n doctor: saudável (sem chaves ausentes)",
    "doctor.issues": "i18n doctor: {count} problema(s)",
    "doctor.missingKey": "faltando: {namespace}.{key}",
    "doctor.placeholderMismatch": "placeholder incompatível: {namespace}.{key} (esperado {expected}, recebido {got})",

    "ui.header.title": "pi — localizado",
    "ui.header.hint": "{locale} • /lang",

    "demo.chat.title": "Chat de demonstração",
    "demo.chat.userLabel": "Você",
    "demo.chat.assistantLabel": "Assistente",
    "demo.chat.userText": "Você pode explicar o que o pi-i18n faz?",
    "demo.chat.assistantText": "Ele localiza a UI de terminal do Pi e extensões — sem modificar o pi-core.",
    "demo.chat.closeHint": "Enter/Esc para fechar",

    "slash.settings.description": "Abrir menu de configurações",
    "slash.model.description": "Selecionar modelo (abre o seletor)",
    "slash.scoped-models.description": "Ativar/desativar modelos para o ciclo com Ctrl+P",
    "slash.export.description": "Exportar sessão (padrão HTML, ou informe .html/.jsonl)",
    "slash.import.description": "Importar e retomar uma sessão de um arquivo JSONL",
    "slash.share.description": "Compartilhar sessão como um gist secreto do GitHub",
    "slash.copy.description": "Copiar a última mensagem do agente para a área de transferência",
    "slash.name.description": "Definir nome de exibição da sessão",
    "slash.session.description": "Mostrar informações e estatísticas da sessão",
    "slash.changelog.description": "Mostrar entradas do changelog",
    "slash.hotkeys.description": "Mostrar todos os atalhos de teclado",
    "slash.fork.description": "Criar um novo fork a partir de uma mensagem anterior",
    "slash.clone.description": "Duplicar a sessão atual na posição atual",
    "slash.tree.description": "Navegar na árvore da sessão (trocar branches)",
    "slash.login.description": "Login com provedor OAuth",
    "slash.logout.description": "Logout do provedor OAuth",
    "slash.new.description": "Iniciar uma nova sessão",
    "slash.compact.description": "Compactar manualmente o contexto da sessão",
    "slash.resume.description": "Retomar outra sessão",
    "slash.reload.description": "Recarregar keybindings, extensões, skills, prompts e temas",
    "slash.quit.description": "Sair do pi",

    "ui.key.model": "modelo",
    "ui.key.thinking": "pensamento",
    "ui.key.tools": "ferramentas",
    "ui.key.followUp": "follow-up",
    "ui.key.expand": "expandir",

    "slash.lang.description": "Trocar o idioma da UI (somente LTR)",

    "tool.common.running": "Executando…",
    "tool.common.done": "Concluído",
    "tool.common.error": "Erro",
    "tool.common.truncated": "truncado",

    "tool.read.label": "ler",
    "tool.read.call": "ler {path}",
    "tool.read.lines": "{count} linhas",

    "tool.bash.label": "bash",
    "tool.bash.call": "$ {command}",
    "tool.bash.exit": "saída {code}",

    "tool.edit.label": "editar",
    "tool.edit.call": "aplicar mudanças {path}",
    "tool.edit.stats": "+{add} / -{del}",

    "tool.write.label": "escrever",
    "tool.write.call": "escrever {path}",
    "tool.write.written": "Gravado",

    "hacks.fk.command.description": "fk: criar fork a partir de uma mensagem de usuário anterior",
    "hacks.fk.help": "Uso: /fk (abre o seletor)",
    "hacks.fk.none": "Não há mensagens de usuário para criar fork",
    "hacks.fk.dialog.title": "Fork",
    "hacks.fk.dialog.pick": "Escolha uma mensagem para criar fork",
    "hacks.fk.dialog.query": "Buscar",
    "hacks.fk.dialog.query.placeholder": "digite para filtrar mensagens",
    "hacks.fk.noMatches": "Nenhuma mensagem de usuário correspondente"
  }
}
