{
  "$schema": "../schemas/pi-i18n.bundle.schema.json",
  "version": 1,
  "namespace": "pi",
  "locale": "zh-TW",
  "messages": {
    "app.name": "pi",

    "language.command.description": "切換介面語言（僅支援 LTR）",
    "language.dialog.title": "語言",
    "language.dialog.pick": "選擇語系",
    "language.dialog.other": "其他…",
    "language.dialog.other.placeholder": "例如：fr、ja、zh-TW",
    "language.changed": "已切換語言為 {locale}",
    "language.alreadySet": "目前語言已是 {locale}",
    "language.reloading": "正在重新載入介面（{locale}）…",
    "language.usage": "用法：/lang [doctor|debug|probe [on|off|reset]|setup beginner|hacks|en|en-US|zh-TW|tw|zhtw|toggle|pick]",
    "language.rtlWarning": "目前尚未支援 RTL（已選擇：{locale}）。",

    "doctor.command.description": "檢查 i18n 套件：缺少鍵與參數占位符不一致",
    "i18n.command.description": "i18n 控制：doctor、debug、probe、setup、hacks",
    "i18n.command.usage": "用法：/lang <doctor|debug|probe [on|off|reset]|setup beginner|hacks>",
    "i18n.hacks.option.on": "core hacks：開",
    "i18n.hacks.option.off": "core hacks：關",
    "i18n.probe.reset": "i18n 探針已重設",
    "i18n.probe.enabled": "i18n 探針已啟用",
    "i18n.probe.disabled": "i18n 探針已停用",
    "i18n.setup.usage": "用法：/lang setup beginner",
    "i18n.setup.applied": "i18n 設定已套用（preset=beginner，locale={locale}）",
    "doctor.ok": "i18n doctor：正常（沒有缺少鍵）",
    "doctor.issues": "i18n doctor：{count} 個問題",
    "doctor.missingKey": "缺少：{namespace}.{key}",
    "doctor.placeholderMismatch": "占位符不一致：{namespace}.{key}（應為 {expected}，目前為 {got}）",

    "ui.header.title": "pi — 已本地化",
    "ui.header.hint": "{locale} • /lang",

    "slash.settings.description": "開啟設定選單",
    "slash.model.description": "選擇模型（開啟選擇器）",
    "slash.scoped-models.description": "啟用/停用模型（用於 Ctrl+P 循環切換）",
    "slash.export.description": "匯出工作階段（預設 HTML，或指定 .html/.jsonl 路徑）",
    "slash.import.description": "從 JSONL 檔案匯入並恢復工作階段",
    "slash.share.description": "以 GitHub secret gist 分享工作階段",
    "slash.copy.description": "複製上一則助理訊息到剪貼簿",
    "slash.name.description": "設定工作階段顯示名稱",
    "slash.session.description": "顯示工作階段資訊與統計",
    "slash.changelog.description": "顯示更新紀錄",
    "slash.hotkeys.description": "顯示所有鍵盤快捷鍵",
    "slash.fork.description": "從先前訊息建立新分岔",
    "slash.tree.description": "瀏覽工作階段樹（切換分支）",
    "slash.login.description": "使用 OAuth 供應商登入",
    "slash.logout.description": "登出 OAuth 供應商",
    "slash.new.description": "開始新工作階段",
    "slash.compact.description": "手動壓縮工作階段上下文",
    "slash.resume.description": "恢復其他工作階段",
    "slash.reload.description": "重新載入鍵位、擴充、技能、提示與主題",
    "slash.quit.description": "結束 pi",

    "ui.key.model": "模型",
    "ui.key.thinking": "思考",
    "ui.key.tools": "工具",
    "ui.key.followUp": "後續訊息",
    "ui.key.expand": "展開",

    "slash.settings.description": "開啟設定選單",
    "slash.model.description": "選擇模型（開啟選擇器）",
    "slash.scoped-models.description": "啟用/停用模型（用於 Ctrl+P 循環切換）",
    "slash.export.description": "匯出工作階段（預設 HTML，或指定 .html/.jsonl 路徑）",
    "slash.import.description": "從 JSONL 檔案匯入並恢復工作階段",
    "slash.share.description": "以 GitHub secret gist 分享工作階段",
    "slash.copy.description": "複製上一則助理訊息到剪貼簿",
    "slash.name.description": "設定工作階段顯示名稱",
    "slash.session.description": "顯示工作階段資訊與統計",
    "slash.changelog.description": "顯示更新紀錄",
    "slash.hotkeys.description": "顯示所有鍵盤快捷鍵",
    "slash.fork.description": "從先前訊息建立新分岔",
    "slash.tree.description": "瀏覽工作階段樹（切換分支）",
    "slash.login.description": "使用 OAuth 供應商登入",
    "slash.logout.description": "登出 OAuth 供應商",
    "slash.new.description": "開始新工作階段",
    "slash.compact.description": "手動壓縮工作階段上下文",
    "slash.resume.description": "恢復其他工作階段",
    "slash.reload.description": "重新載入鍵位、擴充、技能、提示與主題",
    "slash.quit.description": "結束 pi",
    "slash.lang.description": "切換介面語言（僅支援 LTR）",

    "tool.common.running": "執行中…",
    "tool.common.done": "完成",
    "tool.common.error": "錯誤",
    "tool.common.truncated": "已截斷",

    "tool.read.label": "讀取",
    "tool.read.call": "讀取 {path}",
    "tool.read.lines": "{count} 行",

    "tool.bash.label": "bash",
    "tool.bash.call": "$ {command}",
    "tool.bash.exit": "退出 {code}",

    "tool.edit.label": "編輯",
    "tool.edit.call": "套用變更 {path}",
    "tool.edit.stats": "+{add} / -{del}",

    "tool.write.label": "寫入",
    "tool.write.call": "寫入 {path}",
    "tool.write.written": "已寫入",

    "hacks.fk.command.description": "fk：從先前使用者訊息分岔",
    "hacks.fk.help": "用法：/fk（開啟選擇器）",
    "hacks.fk.none": "沒有可用於分岔的使用者訊息",
    "hacks.fk.dialog.title": "分岔",
    "hacks.fk.dialog.pick": "選擇要分岔的訊息",
    "hacks.fk.dialog.query": "搜尋",
    "hacks.fk.dialog.query.placeholder": "輸入關鍵字以篩選訊息",
    "hacks.fk.noMatches": "沒有符合的使用者訊息"
  }
}
