{
  "$schema": "../schemas/pi-i18n.bundle.schema.json",
  "version": 1,
  "namespace": "pi",
  "locale": "zh-CN",
  "messages": {
    "app.name": "pi",

    "language.command.description": "切换界面语言（仅支持 LTR）",
    "language.dialog.title": "语言",
    "language.dialog.pick": "选择语言",
    "language.dialog.other": "其他…",
    "language.dialog.other.placeholder": "例如：fr、ja、zh-TW",
    "language.changed": "语言已设置为 {locale}",
    "language.alreadySet": "当前语言已是 {locale}",
    "language.reloading": "正在为 {locale} 重新加载界面…",
    "language.usage": "用法：/lang [doctor|debug|probe [on|off|reset]|setup beginner|hacks|en|en-US|zh-TW|tw|zhtw|toggle|pick]",
    "language.rtlWarning": "目前尚不支持 RTL（已选择：{locale}）。",

    "doctor.command.description": "检查 i18n 包：缺失键与占位符不匹配",
    "i18n.command.description": "i18n 控制：doctor、debug、probe、setup、hacks",
    "i18n.command.usage": "用法：/lang <doctor|debug|probe [on|off|reset]|setup beginner|hacks>",
    "i18n.hacks.option.on": "core hacks：开",
    "i18n.hacks.option.off": "core hacks：关",
    "i18n.probe.reset": "i18n 探针已重置",
    "i18n.probe.enabled": "i18n 探针已启用",
    "i18n.probe.disabled": "i18n 探针已停用",
    "i18n.setup.usage": "用法：/lang setup beginner",
    "i18n.setup.applied": "i18n 设置已应用（preset=beginner，locale={locale}）",
    "doctor.ok": "i18n doctor：正常（无缺失键）",
    "doctor.issues": "i18n doctor：{count} 个问题",
    "doctor.missingKey": "缺失：{namespace}.{key}",
    "doctor.placeholderMismatch": "占位符不匹配：{namespace}.{key}（期望 {expected}，实际 {got}）",

    "ui.header.title": "pi — 已本地化",
    "ui.header.hint": "{locale} • /lang",

    "slash.settings.description": "打开设置菜单",
    "slash.model.description": "选择模型（打开选择器）",
    "slash.scoped-models.description": "启用/停用模型（用于 Ctrl+P 循环切换）",
    "slash.export.description": "导出会话（默认 HTML，或指定 .html/.jsonl 路径）",
    "slash.import.description": "从 JSONL 文件导入并继续会话",
    "slash.share.description": "以 GitHub secret gist 分享会话",
    "slash.copy.description": "复制上一条助手消息到剪贴板",
    "slash.name.description": "设置会话显示名称",
    "slash.session.description": "显示会话信息与统计",
    "slash.changelog.description": "显示更新日志条目",
    "slash.hotkeys.description": "显示所有键盘快捷键",
    "slash.fork.description": "从之前的消息创建分叉",
    "slash.tree.description": "浏览会话树（切换分支）",
    "slash.login.description": "使用 OAuth 提供商登录",
    "slash.logout.description": "从 OAuth 提供商登出",
    "slash.new.description": "开始新会话",
    "slash.compact.description": "手动压缩会话上下文",
    "slash.resume.description": "恢复另一个会话",
    "slash.reload.description": "重新加载键位、扩展、技能、提示与主题",
    "slash.quit.description": "退出 pi",

    "ui.key.model": "模型",
    "ui.key.thinking": "思考",
    "ui.key.tools": "工具",
    "ui.key.followUp": "后续消息",
    "ui.key.expand": "展开",

    "slash.lang.description": "切换界面语言（仅支持 LTR）",

    "tool.common.running": "执行中…",
    "tool.common.done": "完成",
    "tool.common.error": "错误",
    "tool.common.truncated": "已截断",

    "tool.read.label": "读取",
    "tool.read.call": "读取 {path}",
    "tool.read.lines": "{count} 行",

    "tool.bash.label": "bash",
    "tool.bash.call": "$ {command}",
    "tool.bash.exit": "退出 {code}",

    "tool.edit.label": "编辑",
    "tool.edit.call": "应用变更 {path}",
    "tool.edit.stats": "+{add} / -{del}",

    "tool.write.label": "写入",
    "tool.write.call": "写入 {path}",
    "tool.write.written": "已写入",

    "hacks.fk.command.description": "fk：从之前的用户消息创建分叉",
    "hacks.fk.help": "用法：/fk（打开选择器）",
    "hacks.fk.none": "没有可用于分叉的用户消息",
    "hacks.fk.dialog.title": "分叉",
    "hacks.fk.dialog.pick": "选择要分叉的消息",
    "hacks.fk.dialog.query": "搜索",
    "hacks.fk.dialog.query.placeholder": "输入以筛选消息",
    "hacks.fk.noMatches": "没有匹配的用户消息"
  }
}
